{
  "$schema": "http://json-schema.org/draft-07/schema#",
  "$id": "https://hmer.local/schemas/ink.schema.json",
  "title": "Ink",
  "description": "Tinta online agnóstica à tarefa: trajetória da caneta compartilhada por web, api e ml. Alinhada ao formato InkML usado no treino.",
  "type": "object",
  "required": ["strokes"],
  "additionalProperties": false,
  "properties": {
    "schema_version": {
      "type": "string",
      "default": "1.0",
      "description": "Versão do contrato de tinta."
    },
    "width": {
      "type": "number",
      "exclusiveMinimum": 0,
      "description": "Largura do canvas (CSS px) no momento da captura. Usada para normalização."
    },
    "height": {
      "type": "number",
      "exclusiveMinimum": 0,
      "description": "Altura do canvas (CSS px) no momento da captura."
    },
    "strokes": {
      "type": "array",
      "description": "Lista de traços (cada traço = um pen-down até pen-up).",
      "items": {
        "type": "object",
        "required": ["points"],
        "additionalProperties": false,
        "properties": {
          "points": {
            "type": "array",
            "minItems": 1,
            "description": "Sequência ordenada de pontos do traço.",
            "items": {
              "type": "object",
              "required": ["x", "y"],
              "additionalProperties": false,
              "properties": {
                "x": { "type": "number", "description": "Coord. horizontal relativa ao canvas (CSS px)." },
                "y": { "type": "number", "description": "Coord. vertical relativa ao canvas (CSS px)." },
                "t": { "type": "number", "minimum": 0, "description": "Milissegundos desde o primeiro ponto da tinta. Opcional." }
              }
            }
          }
        }
      }
    },
    "label": {
      "type": "string",
      "description": "LaTeX ground-truth. Presente apenas em coleta/treino; ausente na inferência."
    }
  }
}
