{
  "schema_version": "1.0",
  "width": 640,
  "height": 360,
  "strokes": [
    {
      "points": [
        { "x": 120.0, "y": 180.0, "t": 0 },
        { "x": 128.5, "y": 176.2, "t": 16 },
        { "x": 140.0, "y": 172.0, "t": 33 },
        { "x": 152.0, "y": 175.5, "t": 50 }
      ]
    },
    {
      "points": [
        { "x": 200.0, "y": 150.0, "t": 420 },
        { "x": 200.5, "y": 210.0, "t": 470 }
      ]
    }
  ],
  "label": "x^2"
}
